file_name,aspect_ratio,x_start_pct,y_start_pct,width_pct,height_pct,alt text,reason,score,similar_to
Cloudy orange sunset to dark on Mediterranean sea - rejected.mov,16:9,0,25,100,60,Sunset over Mediterranean sea transitioning to night,"Kept the horizon aligned in the lower third, with beautiful clouds and gradient sky dominating the frame.",8, ""
19090600_1_apo8_prob4.mov,3:2,10,10,80,80,Street scene with people walking and evening shadows,Focused crop on human activity and depth of street lines for storytelling.,7
"Aerial view of city lights at night clouds passing.mov",2:1,0,20,100,50,City lights glowing under moving clouds at night,Wide crop to emphasize horizontal sprawl and moody atmosphere.,9
Cloud frame and mountains timelapse - rejected.mov,3:4,30,0,40,100,Timelapse clouds rolling over alpine mountains,Tall crop enhances vertical motion of clouds and layering of landscape.,7
Cascade of pine tree mountains in the mist.mov,4:3,10,10,80,80,Pine-covered misty mountain range layers,Classic landscape framing with a slightly centered balance for calm atmosphere.,8
Clouds and mountains timelapse.mov,5:4,15,5,70,90,Fast-moving clouds over scenic mountain backdrop,Focuses tightly on dynamic sky motion while keeping the mountain base.,8
A001_11271315_C025.mov,9:16,0,0,100,100,Vertical shot of modern architecture detail,Used full frame for vertical storytelling; lines guide viewer upward.,7
A001_11271328_C027.mov,1:2,20,0,60,100,Tall perspective view of structure or landscape,Narrow vertical to highlight depth and dramatic proportions.,7
A001_11271326_C026.mov,3:4,10,0,80,100,Architectural lines and contrast in vertical format,Focused on leading lines from base to top of frame.,6
